{
  "name": "puppet-master",
  "services": [
    {
      "src": "src/screenshot.ts",
      "examples": [
        {
          "name": "Basic",
          "input": {
            "url": "https://youtube.com"
          }
        },
        {
          "name": "Custom",
          "input": {
            "url": "https://github.com",
            "type": "jpeg",
            "quality": 90,
            "viewport": {
              "width": 1920,
              "height": 1080,
              "deviceScaleFactor": 2
            },
            "userAgent": "Mozilla/5.0 (Macintosh; Intel Mac OS X 10_14_5) AppleWebKit/537.36 (KHTML, like Gecko) Chrome/76.0.3809.132 Safari/537.36"
          }
        }
      ]
    },
    {
      "src": "src/pdf.ts",
      "examples": [
        {
          "name": "Basic",
          "input": {
            "url": "https://producthunt.com"
          }
        }
      ]
    }
  ],
  "saas": {
    "name": "Puppet Master",
    "heading": "Puppeteer as a Service",
    "subheading": "Control headless Chrome via a simple SaaS API!",
    "repo": "https://github.com/saasify-sh/puppet-master",
    "logo": "./media/logo.svg",
    "favicon": "./media/favicon.ico"
  },
  "env": {
    "EXAMPLE_DYNAMIC_ENV_VAR": "@my-dynamic-secret",
    "EXAMPLE_STATIC_ENV_VAR": "foobar"
  }
}
